{
  "schemaVersion": 1,
  "caseId": "case:hypothetical:capability-tier:v1",
  "title": "Hypothetical identity-conditioned capability tier",
  "status": "hypothetical",
  "observedAt": "2026-08-01",
  "unit": {
    "providerId": "provider:hypothetical",
    "surface": "api",
    "model": "model:hypothetical",
    "accessTier": "verified-research",
    "region": "unspecified",
    "retentionMode": "research-retention"
  },
  "actors": [
    {"actorId": "provider:hypothetical", "type": "Provider", "label": "Hypothetical Provider"},
    {"actorId": "researcher:hypothetical", "type": "Researcher", "label": "Authorized researcher"}
  ],
  "resources": [
    {"resourceId": "capability:hypothetical", "type": "ModelCapability", "label": "Advanced analysis capability"}
  ],
  "claims": [
    {
      "claimId": "claim:hypothetical:1",
      "class": "D",
      "statement": "A verified access tier conditions availability of the hypothetical capability.",
      "confidence": "low",
      "evidenceRefs": ["evidence:hypothetical"],
      "counterEvidenceRefs": [],
      "assumptions": ["The record is illustrative and not a claim about a real Provider."],
      "falsifier": "A real case schema cannot express identity-conditioned access without Provider-specific fields.",
      "unresolved": []
    }
  ],
  "relations": [
    {
      "relationId": "relation:hypothetical:1",
      "subjectId": "provider:hypothetical",
      "predicate": "conditions",
      "objectId": "capability:hypothetical",
      "powerDimensions": ["normative", "infrastructural"],
      "evidenceRefs": ["evidence:hypothetical"]
    }
  ],
  "evidenceRefs": ["evidence:hypothetical"],
  "counterfactuals": ["Compare the same model and task under an unverified tier."],
  "unresolved": ["No real Provider behavior is represented."],
  "privacy": {"containsPersonalData": false, "redactions": []}
}
